[
  {
    "level_id": 1,
    "pack_id": "starter_birds",
    "mode": "campaign",
    "title": "Meet the Birds",
    "round_duration_sec": 30,
    "species_count": 6,
    "species_pool": [
      "NOCA",
      "CARW",
      "TUTI",
      "BLJA",
      "AMCR",
      "AMRO"
    ],
    "clip_selection": "canonical",
    "channel_mode": "single",
    "event_density": "low",
    "overlap_probability": 0,
    "scoring_window_ms": 2000,
    "spectrogram_mode": "full"
  },
  {
    "level_id": 2,
    "pack_id": "starter_birds",
    "mode": "campaign",
    "title": "Sound Variations",
    "round_duration_sec": 30,
    "species_count": 6,
    "species_pool": [
      "NOCA",
      "CARW",
      "TUTI",
      "BLJA",
      "AMCR",
      "AMRO"
    ],
    "clip_selection": 3,
    "channel_mode": "single",
    "event_density": "low",
    "overlap_probability": 0,
    "scoring_window_ms": 2000,
    "spectrogram_mode": "full"
  },
  {
    "level_id": 3,
    "pack_id": "starter_birds",
    "mode": "campaign",
    "title": "Full Repertoire",
    "round_duration_sec": 30,
    "species_count": 6,
    "species_pool": [
      "NOCA",
      "CARW",
      "TUTI",
      "BLJA",
      "AMCR",
      "AMRO"
    ],
    "clip_selection": "all",
    "channel_mode": "single",
    "event_density": "low",
    "overlap_probability": 0,
    "scoring_window_ms": 2000,
    "spectrogram_mode": "full"
  },
  {
    "level_id": 4,
    "pack_id": "starter_birds",
    "mode": "campaign",
    "title": "Both Ears",
    "round_duration_sec": 30,
    "species_count": 6,
    "species_pool": [
      "NOCA",
      "CARW",
      "TUTI",
      "BLJA",
      "AMCR",
      "AMRO"
    ],
    "clip_selection": "canonical",
    "channel_mode": "offset",
    "event_density": "low",
    "overlap_probability": 0,
    "scoring_window_ms": 2000,
    "spectrogram_mode": "full"
  },
  {
    "level_id": 5,
    "pack_id": "starter_birds",
    "mode": "campaign",
    "title": "Variations + Both Ears",
    "round_duration_sec": 30,
    "species_count": 6,
    "species_pool": [
      "NOCA",
      "CARW",
      "TUTI",
      "BLJA",
      "AMCR",
      "AMRO"
    ],
    "clip_selection": 3,
    "channel_mode": "offset",
    "event_density": "low",
    "overlap_probability": 0,
    "scoring_window_ms": 2000,
    "spectrogram_mode": "full"
  },
  {
    "level_id": 6,
    "pack_id": "starter_birds",
    "mode": "campaign",
    "title": "Master Birder",
    "round_duration_sec": 30,
    "species_count": 6,
    "species_pool": [
      "NOCA",
      "CARW",
      "TUTI",
      "BLJA",
      "AMCR",
      "AMRO"
    ],
    "clip_selection": "all",
    "channel_mode": "offset",
    "event_density": "low",
    "overlap_probability": 0,
    "scoring_window_ms": 2000,
    "spectrogram_mode": "full"
  },
  {
    "level_id": 1,
    "pack_id": "expanded_backyard",
    "mode": "campaign",
    "title": "Meet the Flock",
    "round_duration_sec": 30,
    "species_count": 9,
    "species_pool": [
      "NOCA",
      "CARW",
      "BLJA",
      "AMCR",
      "TUTI",
      "BEKI",
      "RSHA",
      "AGOL",
      "CACH",
      "PIWA",
      "WTSP",
      "HOFI",
      "EABL",
      "AMRO",
      "HETH",
      "BHNU",
      "BRCR",
      "WBNU",
      "YBSA",
      "RBWO",
      "DOWO",
      "HAWO",
      "NOFL",
      "PIWO",
      "BRTH",
      "GRCA",
      "MODO",
      "NOMO",
      "GCKI",
      "RCKI",
      "COHA",
      "SSHA",
      "RTHA",
      "RTHU",
      "BAOW",
      "COGR",
      "FICR",
      "CEDW",
      "DEJU",
      "EATO",
      "WEVI",
      "ACFL",
      "EAPH",
      "GCFL",
      "EAWP",
      "REVI",
      "WOTH",
      "KILL",
      "BAOR",
      "NHWR",
      "EUST",
      "YBCU",
      "CHSW",
      "SCTA",
      "VEER",
      "SUTA",
      "BGGN",
      "GBHE",
      "GRHE",
      "RBNU"
    ],
    "clip_selection": "canonical",
    "channel_mode": "single",
    "event_density": "low",
    "overlap_probability": 0,
    "scoring_window_ms": 2000,
    "spectrogram_mode": "full"
  },
  {
    "level_id": 2,
    "pack_id": "expanded_backyard",
    "mode": "campaign",
    "title": "Sound Variations",
    "round_duration_sec": 30,
    "species_count": 9,
    "species_pool": [
      "NOCA",
      "CARW",
      "BLJA",
      "AMCR",
      "TUTI",
      "BEKI",
      "RSHA",
      "AGOL",
      "CACH",
      "PIWA",
      "WTSP",
      "HOFI",
      "EABL",
      "AMRO",
      "HETH",
      "BHNU",
      "BRCR",
      "WBNU",
      "YBSA",
      "RBWO",
      "DOWO",
      "HAWO",
      "NOFL",
      "PIWO",
      "BRTH",
      "GRCA",
      "MODO",
      "NOMO",
      "GCKI",
      "RCKI",
      "COHA",
      "SSHA",
      "RTHA",
      "RTHU",
      "BAOW",
      "COGR",
      "FICR",
      "CEDW",
      "DEJU",
      "EATO",
      "WEVI",
      "ACFL",
      "EAPH",
      "GCFL",
      "EAWP",
      "REVI",
      "WOTH",
      "KILL",
      "BAOR",
      "NHWR",
      "EUST",
      "YBCU",
      "CHSW",
      "SCTA",
      "VEER",
      "SUTA",
      "BGGN",
      "GBHE",
      "GRHE",
      "RBNU"
    ],
    "clip_selection": 3,
    "channel_mode": "single",
    "event_density": "low",
    "overlap_probability": 0,
    "scoring_window_ms": 2000,
    "spectrogram_mode": "full"
  },
  {
    "level_id": 3,
    "pack_id": "expanded_backyard",
    "mode": "campaign",
    "title": "Full Repertoire",
    "round_duration_sec": 30,
    "species_count": 9,
    "species_pool": [
      "NOCA",
      "CARW",
      "BLJA",
      "AMCR",
      "TUTI",
      "BEKI",
      "RSHA",
      "AGOL",
      "CACH",
      "PIWA",
      "WTSP",
      "HOFI",
      "EABL",
      "AMRO",
      "HETH",
      "BHNU",
      "BRCR",
      "WBNU",
      "YBSA",
      "RBWO",
      "DOWO",
      "HAWO",
      "NOFL",
      "PIWO",
      "BRTH",
      "GRCA",
      "MODO",
      "NOMO",
      "GCKI",
      "RCKI",
      "COHA",
      "SSHA",
      "RTHA",
      "RTHU",
      "BAOW",
      "COGR",
      "FICR",
      "CEDW",
      "DEJU",
      "EATO",
      "WEVI",
      "ACFL",
      "EAPH",
      "GCFL",
      "EAWP",
      "REVI",
      "WOTH",
      "KILL",
      "BAOR",
      "NHWR",
      "EUST",
      "YBCU",
      "CHSW",
      "SCTA",
      "VEER",
      "SUTA",
      "BGGN",
      "GBHE",
      "GRHE",
      "RBNU"
    ],
    "clip_selection": "all",
    "channel_mode": "single",
    "event_density": "low",
    "overlap_probability": 0,
    "scoring_window_ms": 2000,
    "spectrogram_mode": "full"
  },
  {
    "level_id": 4,
    "pack_id": "expanded_backyard",
    "mode": "campaign",
    "title": "Both Ears",
    "round_duration_sec": 30,
    "species_count": 9,
    "species_pool": [
      "NOCA",
      "CARW",
      "BLJA",
      "AMCR",
      "TUTI",
      "BEKI",
      "RSHA",
      "AGOL",
      "CACH",
      "PIWA",
      "WTSP",
      "HOFI",
      "EABL",
      "AMRO",
      "HETH",
      "BHNU",
      "BRCR",
      "WBNU",
      "YBSA",
      "RBWO",
      "DOWO",
      "HAWO",
      "NOFL",
      "PIWO",
      "BRTH",
      "GRCA",
      "MODO",
      "NOMO",
      "GCKI",
      "RCKI",
      "COHA",
      "SSHA",
      "RTHA",
      "RTHU",
      "BAOW",
      "COGR",
      "FICR",
      "CEDW",
      "DEJU",
      "EATO",
      "WEVI",
      "ACFL",
      "EAPH",
      "GCFL",
      "EAWP",
      "REVI",
      "WOTH",
      "KILL",
      "BAOR",
      "NHWR",
      "EUST",
      "YBCU",
      "CHSW",
      "SCTA",
      "VEER",
      "SUTA",
      "BGGN",
      "GBHE",
      "GRHE",
      "RBNU"
    ],
    "clip_selection": "canonical",
    "channel_mode": "offset",
    "event_density": "low",
    "overlap_probability": 0,
    "scoring_window_ms": 2000,
    "spectrogram_mode": "full"
  },
  {
    "level_id": 5,
    "pack_id": "expanded_backyard",
    "mode": "campaign",
    "title": "Variations + Both Ears",
    "round_duration_sec": 30,
    "species_count": 9,
    "species_pool": [
      "NOCA",
      "CARW",
      "BLJA",
      "AMCR",
      "TUTI",
      "BEKI",
      "RSHA",
      "AGOL",
      "CACH",
      "PIWA",
      "WTSP",
      "HOFI",
      "EABL",
      "AMRO",
      "HETH",
      "BHNU",
      "BRCR",
      "WBNU",
      "YBSA",
      "RBWO",
      "DOWO",
      "HAWO",
      "NOFL",
      "PIWO",
      "BRTH",
      "GRCA",
      "MODO",
      "NOMO",
      "GCKI",
      "RCKI",
      "COHA",
      "SSHA",
      "RTHA",
      "RTHU",
      "BAOW",
      "COGR",
      "FICR",
      "CEDW",
      "DEJU",
      "EATO",
      "WEVI",
      "ACFL",
      "EAPH",
      "GCFL",
      "EAWP",
      "REVI",
      "WOTH",
      "KILL",
      "BAOR",
      "NHWR",
      "EUST",
      "YBCU",
      "CHSW",
      "SCTA",
      "VEER",
      "SUTA",
      "BGGN",
      "GBHE",
      "GRHE",
      "RBNU"
    ],
    "clip_selection": 3,
    "channel_mode": "offset",
    "event_density": "low",
    "overlap_probability": 0,
    "scoring_window_ms": 2000,
    "spectrogram_mode": "full"
  },
  {
    "level_id": 6,
    "pack_id": "expanded_backyard",
    "mode": "campaign",
    "title": "Master Birder",
    "round_duration_sec": 30,
    "species_count": 9,
    "species_pool": [
      "NOCA",
      "CARW",
      "BLJA",
      "AMCR",
      "TUTI",
      "BEKI",
      "RSHA",
      "AGOL",
      "CACH",
      "PIWA",
      "WTSP",
      "HOFI",
      "EABL",
      "AMRO",
      "HETH",
      "BHNU",
      "BRCR",
      "WBNU",
      "YBSA",
      "RBWO",
      "DOWO",
      "HAWO",
      "NOFL",
      "PIWO",
      "BRTH",
      "GRCA",
      "MODO",
      "NOMO",
      "GCKI",
      "RCKI",
      "COHA",
      "SSHA",
      "RTHA",
      "RTHU",
      "BAOW",
      "COGR",
      "FICR",
      "CEDW",
      "DEJU",
      "EATO",
      "WEVI",
      "ACFL",
      "EAPH",
      "GCFL",
      "EAWP",
      "REVI",
      "WOTH",
      "KILL",
      "BAOR",
      "NHWR",
      "EUST",
      "YBCU",
      "CHSW",
      "SCTA",
      "VEER",
      "SUTA",
      "BGGN",
      "GBHE",
      "GRHE",
      "RBNU"
    ],
    "clip_selection": "all",
    "channel_mode": "offset",